nc_path,target_text
/home/manas/WeatherLMM/forecast_text_Cleaned_6months/forecast_text/2020-05-16/ifs_fc_sfc_0000_12_20200516.nc,"Valid 12Z Sat May 16 2020 - 12Z Mon May 18 2020

...There is a slight risk of excessive rainfall over The Lower
Mississippi Valley and parts of the Southern Plains...

...Heavy rain and possible Flash Flooding will move into the Great
Lakes on Sunday and into the Lower Great Lakes/Central
Appalachians by Monday...

...Surface low near Southern Florida is being monitored for
tropical development as it moves away from the coast...

A quasi-stationary front over the Southern Plains is connected to
a front
over the Central Plains eastward to the Mid-Atlantic that will
slowly move northward across the Ohio Valley to the Mid-Atlantic
as a warm front on Sunday into Monday.  Moisture from the Western
Gulf of Mexico will stream northward east of the quasi-stationary
front over the Southern Plains and overrunning the returning warm
front over the Ohio Valley into the Great Lakes.  The WPC has
issued a slight risk of excessive rainfall over The Lower
Mississippi Valley and parts of the Southern Plains. The resulting
showers and thunderstorms will produce heavy rain over the region
producing mainly localized scattered flash flooding.  As the warm
front moves northward the area of heavy rain will move northward
into the Great Lakes on Sunday and into the Lower Great
Lakes/Central Appalachians by Monday.  As the associated slow
moving cold front moves eastward a general area of rain and
showers/thunderstorms will continue from the Gulf Coast to the
Great Lakes that will, likewise, move slowly eastward to parts of
the Central/Eastern Gulf Coast to the Lower Great Lakes/Northeast
by Monday.

In the West, an approaching upper-level low and associated front
will increase precipitation chances for the Pacific Northwest and
Northern California on Saturday and spreading eastward on Sunday. 
Rain totals could be up to 2 inches in portions of Northern
California and far Southwestern Oregon.  Mostly rain is expected,
with some snow possible in the highest elevations.  Elsewhere, a
surface low near Southern Florida is being monitored for tropical
development as it moves away from the coast."
/home/manas/WeatherLMM/forecast_text_Cleaned_6months/forecast_text/2020-05-16/ifs_fc_sfc_1200_12_20200516.nc,"Valid 00Z Sun May 17 2020 - 00Z Tue May 19 2020

...Heavy rain with strong to severe thunderstorms could cause
flash flooding for portions of the Mississippi Valley, Ohio
Valley, and Great Lakes through Monday...

...Tropical Depression One has formed, expected to strengthen to a
tropical storm tonight...

...Precipitation is likely to increase across the Northwest...

...Critical fire weather conditions are likely for parts of the
Great Basin and Southwest...

A surface low pressure system is forecast to move slowly eastward
across the Middle Mississippi Valley and Great Lakes region over
the next couple of days. Rain and thunderstorms are expected in
the vicinity of the low, as well as east along the slowly lifting
warm front and ahead of the cold front moving eastward across the
Mississippi, Tennessee, and Ohio Valleys. Through tonight, a
Slight Risk of severe weather is in place for portions of the
Lower Mississippi Valley, and through Sunday evening, that area
could receive 1 to 2 inches of rain with locally higher amounts.
So Slight Risks of excessive rainfall/flash flooding are also in
place there tonight and into Sunday. Closer to the low, rainfall
amounts of 2 to 3 inches should be widespread from the Midwest to
Great Lakes and parts of the Upper Ohio Valley. Slight Risks of
flash flooding are outlooked for those areas as well over the next
couple days considering those rainfall amounts, and strong to
severe thunderstorms cannot be ruled out. Cool temperatures are
expected behind this low.

The National Hurricane Center has determined that the low pressure
system east of Florida is now Tropical Depression One. The
depression is forecast to strengthen to a tropical storm tonight
and move northward through Monday. This is expected to affect the
North Carolina coast with heavy rain, tropical-storm-force winds,
dangerous surf, and rip currents. Please see the National
Hurricane Center for more information on this system.

A deep upper-level low is expected to approach the West over the
next couple of days, pushing a frontal system eastward across the
Pacific Northwest and into the Great Basin and California. This
will cause increasing precipitation chances for those areas.
Through Monday evening, rainfall of 1 to 3 inches is forecast for
portions of northern California and western Oregon. Most
precipitation should fall as rain, but higher elevations of the
Sierra Nevada could receive a few inches of snow. Additionally,
high temperatures are expected to be 10 to 20 degrees below normal
for northern California and parts of Oregon on Sunday, spreading
south and east Monday.

In between the upper-level low in the West and the system in the
eastern half of the country, upper-level ridging is expected
across the Great Basin into the Rockies and Plains. This will lead
to temperatures that are above normal by 10 to 20 degrees in those
areas underneath the ridge. The dry, hot conditions could also
cause fire danger, and the Storm Prediction Center has Elevated to
Critical Risks for fire weather in place on Sunday and Monday for
portions of the Southwest, Central Great Basin, and Four Corners."
/home/manas/WeatherLMM/forecast_text_Cleaned_6months/forecast_text/2020-05-17/ifs_fc_sfc_0000_12_20200517.nc,"Valid 12Z Sun May 17 2020 - 12Z Tue May 19 2020

...There is a slight risk of severe thunderstorms over parts of
the Western Ohio Valley...

...There is a slight risk of excessive rainfall over parts of the
Great Lakes/Ohio Valley and over parts of the Lower Mississippi
and Tennessee Valleys...

...Tropical Storm Arthur has formed and is forecast to move
northeastward way from the U. S. Coast...

...Critical fire weather conditions are likely for parts of the
Great Basin and Southwest...

Low pressure over the Middle Mississippi Valley will slowly move
eastward across the Great Lakes/Ohio Valley and stall over the
Ohio Valley Monday into Tuesday morning.  The system will produce
rain and thunderstorms over the Ohio Valley and parts of the Great
Lakes on Sunday.  The SPC has issued a Slight Risk of severe
thunderstorms over parts of the Western Ohio Valley with the main
threat will be tornadoes and damaging thunderstorm wind through
Sunday and into Sunday night.  In addition, the WPC has issued a
slight risk of excessive rainfall over parts of the Great
Lakes/Ohio Valley and over parts of the Lower Mississippi and
Tennessee Valleys.  The associated heavy rain will aid in
producing mainly localized areas of scattered flash flooding over
those regions. On Monday the heavy rain will be over the parts of
Great Lakes, Ohio Valley, Tennessee Valley, and Southern
Appalachians. 

The National Hurricane Center has determined that the low pressure
system east of Florida is now Tropical Storm Arthur and is
forecast to move northeastward way from the U. S. Coast. The
eastern end of the aforementioned system will be a front over the
Mid-Atlantic and as Arthur moves northeastward and associated
region of tropical moisture will move into the front aiding in the
development of showers and thunderstorms with associated heavy
rain over the Mid-Atlantic on Monday into Tuesday.  Furthermore,
Arthur will produce heavy rain, tropical-storm-force winds,
dangerous surf, and rip currents along the North Carolina Coast on
Monday.  Please see the National Hurricane Center for more
information on this system.

A deep upper-level low is expected to approach the West Coast
pushing a front eastward across the Pacific Northwest and into the
Great Basin and California.  This will cause increasing
precipitation chances for those areas. Through Monday evening,
rainfall of 1 to 3 inches is forecast for portions of Northern
California and Western Oregon.  Most precipitation should fall as
rain, but higher elevations of the Sierra Nevada could receive a
few inches of snow.

In between the upper-level low in the West and the system in the
eastern half of the country, upper-level ridging is expected
across the Great Basin into the Rockies and Plains.  This will
lead to temperatures that are above average by 10 to 20 degrees in
those areas underneath the ridge.  The dry, hot conditions could
also cause fire danger, and the Storm Prediction Center has
Elevated to Critical Risks for fire weather in place on Sunday and
Monday for portions of the Southwest, Central Great Basin, and
Four Corners."
/home/manas/WeatherLMM/forecast_text_Cleaned_6months/forecast_text/2020-05-17/ifs_fc_sfc_1200_12_20200517.nc,"Valid 00Z Mon May 18 2020 - 00Z Wed May 20 2020

...Tropical Storm Arthur is forecast to move close to the North
Carolina coast overnight into Monday...

...Heavy rainfall and flash flooding expected with thunderstorms
over portions of the Midwest through tonight and the Ohio Valley
Monday...

...Rain and higher elevation snow forecast to continue across
portions of the West...

...Fire weather danger will be widespread across portions of the
Central Great Basin, Southwest, and Four Corners region...

Tropical Storm Arthur is expected to move northward overnight and
approach the Outer Banks of North Carolina. Tropical Storm
Warnings are in effect for portions of the North Carolina coast,
where tropical-storm-force winds are expected along with locally
heavy rain. Dangerous coastal surf and rip currents are forecast
to spread northward from the Southeast into the Mid-Atlantic over
the next couple of days. Please see the National Hurricane Center
for more information on Arthur.

A surface low pressure system is forecast to slowly meander over
the Ohio Valley over the next couple of days, and rain and
thunderstorms are likely in its vicinity and southward along its
associated warm front. Today into tonight, a Moderate Risk of
flash flooding and a Slight Risk of severe weather are in place
for much of Illinois and western parts of Indiana, with some
severe and flash flooding risk stretching farther south as well.
Then on Monday, a Moderate Risk of flash flooding is outlined
across portions of the Ohio Valley, with a Slight Risk of
excessive rainfall farther north over the Upper Great Lakes and
southward toward the Southern Appalachians. Flash Flood and Flood
Watches are also in effect, and strong to severe thunderstorms are
also possible.

A frontal system will continue to move slowly eastward across the
Intermountain West over the next couple of days ahead of a deep
upper-level low making its way into the West Coast. Pacific
moisture should continue to cause precipitation in the Pacific
Northwest, California, and increase over the Great Basin Monday
and Tuesday. While most precipitation will fall as rain, the
Sierra Nevada could receive several inches of snow, and some
Winter Storm Warnings are in effect.

In between the upper-level low in the West and the systems in the
eastern half of the country, upper-level ridging is expected
across the Great Basin into the Rockies and Plains. This will lead
to temperatures that are above average by 10 to 20 degrees in
those areas underneath the ridge. The dry, hot conditions could
also cause fire danger, and the Storm Prediction Center has
Elevated to Critical Risks for fire weather in place today through
Tuesday for portions of the Southwest, Central Great Basin, and
Four Corners. Red Flag Warnings are also in effect."
/home/manas/WeatherLMM/forecast_text_Cleaned_6months/forecast_text/2020-05-18/ifs_fc_sfc_0000_12_20200518.nc,"Valid 12Z Mon May 18 2020 - 12Z Wed May 20 2020

...There is a moderate risk of excessive rainfall over the Ohio
Valley...

...Rain and higher elevation snow forecast to continue across
portions of the West...

...Fire weather danger will be widespread across portions of the
Central Great Basin, Southwest, and Four Corners region...

...Tropical Storm Arthur is forecast to move close to the North
Carolina coast Monday morning...

A storm over the the Ohio Valley/Great Lakes will produce very
heavy rain over parts of the Ohio Valley/Great Lakes into the
Southern Appalachians.  The WPC has issued a moderate risk of
excessive rainfall over the Ohio Valley  The Heavy rain will aid
producing numerous areas of flash flooding which may also impact
larger rivers. Also, the WPC has issued a slight risk of excessive
rainfall over the Southern Appalachians northward into the Great
Lakes. Here the heavy rain will aid in producing mainly localized
areas of scattered flash flooding.  The region of heavy rain will
move into the Central/Southern Appalachians on Tuesday into
Wednesday.     

A system over the Western U. S. will continue to move slowly
eastward across the Intermountain West.  Pacific moisture should
continue to cause precipitation in the Pacific Northwest,
California, and increase over the Great Basin Monday and Tuesday.
While most precipitation will fall as rain, the Sierra Nevada
could receive several inches of snow, and some Winter Storm
Warnings are in effect.

In between the upper-level low in the West and the systems in the
eastern half of the country, upper-level ridging is expected
across the Great Basin into the Rockies and Plains.  This will
lead to temperatures that are above average by 10 to 20 degrees in
those areas underneath the ridge.  The dry, hot conditions could
also cause fire danger, and the Storm Prediction Center has
Elevated to Critical Risks for fire weather in place through
Tuesday for portions of the Southwest, Central Great Basin, and
Four Corners. Red Flag Warnings are also in effect.

Tropical Storm Arthur is expected to move northeastward out over
the Western Atlantic this afternoon after its close approach to
North Carolina. Currently Tropical Storm Warnings are in effect
for portions of the North Carolina coast, where
tropical-storm-force winds are expected along with locally heavy
rain.  Dangerous coastal surf and rip currents are forecast to
spread northward from the Southeast into the Mid-Atlantic over the
next couple of days.  Please see the National Hurricane Center for
more information on Arthur."
/home/manas/WeatherLMM/forecast_text_Cleaned_6months/forecast_text/2020-05-18/ifs_fc_sfc_1200_12_20200518.nc,"Valid 00Z Tue May 19 2020 - 00Z Thu May 21 2020

...A slow-moving system is likely to produce very heavy rains and
flash flooding from the Ohio Valley to western Virginia and the
Carolinas...

...Tropical Storm Arthur to produce dangerous surf conditions and
rip currents along the Mid-Atlantic coast...

...Flooding possible across portions of California, the Pacific
Northwest and the northern Rockies...

...Critical fire weather conditions to continue across portions of
the Southwest and Four Corners Region...

A slow-moving system will continue to produce heavy rains across
portions of the Ohio Valley on Monday before shifting into the
southern Appalachians, Carolinas, and western Virginia on Tuesday
and Wednesday.  This system is expected to produce several inches
of rain, with flash flooding likely, especially across portions of
Indiana, Kentucky and Ohio on Monday and then across parts of the
western Carolinas and Virginia Tuesday and Wednesday.  In addition
to heavy rains, there is also the potential for strong to severe
thunderstorms to develop, especially across portions of eastern
Kentucky and central Ohio Monday afternoon and evening.

Farther east, Tropical Storm Arthur will continue to track east
away from the North Carolina Outer Banks.  However, dangerous
coastal surf conditions and rip currents are forecast to spread
north along the Mid-Atlantic coast and persist during the next
couple of days.

Meanwhile, an upper level low moving east from the eastern Pacific
is expected to produce widespread precipitation across the western
U.S.  This includes higher elevation snow, with several inches
forecast to accumulate across the higher peaks of the Sierra. 
Significant rainfall accumulations are forecast for portions of
the Sierra foothills and the interior valleys of California --
raising the potential for flash flooding across those areas. 
Significant rains along with snowmelt will also raise flooding
concerns across portions of the Northwest and northern Rockies.

Dry and windy conditions will prevail across the Southwest --
promoting elevated to critical fire weather conditions across much
of the Southwest through the Four Corners region on Tuesday."
/home/manas/WeatherLMM/forecast_text_Cleaned_6months/forecast_text/2020-05-19/ifs_fc_sfc_0000_12_20200519.nc,"Valid 12Z Tue May 19 2020 - 12Z Thu May 21 2020

...There is a moderate risk of excessive rainfall over parts of
the Southern Appalachians ...

...There is a slight risk of severe thunderstorms over parts of
the Northern High Plains...

...Tropical Storm Arthur to produce dangerous surf conditions and
rip currents along the Mid-Atlantic Coast...

...Critical fire weather conditions to continue across portions of
the Southwest and Four Corners Region...

A slow-moving storm will continue to produce heavy rains across
portions of the Southern Appalachians and the Southern
Mid-Atlantic on Tuesday and Wednesday.  This system is expected to
produce several inches of rain, with flash flooding likely,
especially across portions of Southern Appalachians and
Mid-Atlantic Tuesday and Wednesday. 

Meanwhile, an upper level low moving east from the Eastern Pacific
is expected to produce widespread precipitation across the Western
U.S.  This includes higher elevation snow, with several inches
forecast to accumulate across the higher peaks of the Sierra
Nevada Mountains.  Significant rains along with snowmelt will also
raise flooding concerns across portions of the Northwest and
Northern Rockies.  In addition, the SPC has issued a slight risk
of severe thunderstorms over parts of the Northern High Plains
with the main threats of damaging thunderstorm wind, hail, and
tornadoes. 

Dry and windy conditions will prevail across the Southwest --
promoting elevated to critical fire weather conditions across much
of the Southwest through the Four Corners region on Tuesday.

Farther east, Tropical Storm Arthur will continue to track east
away from the North Carolina Outer Banks.  However, dangerous
coastal surf conditions and rip currents are forecast to spread
north along the Mid-Atlantic Coast and persist during the next
couple of days."
/home/manas/WeatherLMM/forecast_text_Cleaned_6months/forecast_text/2020-05-19/ifs_fc_sfc_1200_12_20200519.nc,"Valid 00Z Wed May 20 2020 - 00Z Fri May 22 2020

...Copious amounts of rain to soak the eastern Ohio Valley,
southern Appalachians, and southern Mid-Atlantic...

...Arthur exits stage-right, but lingering coastal impacts look to
continue through Thursday...

...Daily episodes of severe weather to transpire in the Great
Plains, Critical fire weather conditions stick around across
portions of the Southwest and Four Corners Region...

A cut-off upper level low is dousing the Ohio Valley and southern
Mid-Atlantic with bands of heavy showers and thunderstorms. The
storm system's seemingly endless supply of moisture and slow
movement is a recipe for flooding concerns in these regions
through mid-week. Moderate Risks for excessive rainfall remain in
place for the eastern Ohio Valley and southern Appalachians this
evening. The heavy rain threat becomes more focused in the
southern Mid-Atlantic tomorrow where a Moderate Risk fore
excessive rainfall is also present. There is also the potential
for some severe weather in portions of the Southeast this evening
and again on Wednesday. By Thursday evening, rainfall amounts
could exceed seven inches in parts of the southern Appalachians.
River flooding in parts of southeast Virginia and the western
Carolinas could become increasingly problematic late week.

While Arthur looks to track further south and east away from the
U.S. over the next couple days, the pressure gradient it and the
upper low over the southeast is generating with strong high
pressure to the north sets the stage for prolonged onshore winds
along the Mid-Atlantic coast. Coastal flood warnings and
advisories continue for the Virginia Tidewater and much of the
lower DelMarVa peninsula. Potential impacts include flooded roads,
beach erosion, and inundated homes and businesses.

Farther west, severe weather is forecast to become a daily
occurrence in the Great Plains through week's end. A cold front
should trigger strong-to-severe storms in western Montana and
north-central Idaho this evening. Meanwhile, a slow progressing
frontal boundary will be the catalyst for thunderstorms up and
down the High Plains today, Wednesday, and again on Thursday. The
front's slow nature could also lead to flash flooding concerns in
the northern and central High Plains. To the south, dry and windy
conditions will prevail across the Southwest, promoting elevated
to critical fire weather conditions across much of the Southwest
through the Four Corners region through Wednesday."
/home/manas/WeatherLMM/forecast_text_Cleaned_6months/forecast_text/2020-05-20/ifs_fc_sfc_0000_12_20200520.nc,"Valid 12Z Wed May 20 2020 - 12Z Fri May 22 2020

...There is a high risk of excessive rainfall over the Southern
Appalachians...

...There is an enhanced risk of severe thunderstorms over parts of
the Northern/Central High Plains...

...Daily episodes of severe weather to transpire in the High
Plains and Critical fire weather conditions linger across portions
of the Southwest and Four Corners Region...

An upper-level low producing heavy rain over the Ohio Valley and
Southern Mid-Atlantic with bands of heavy showers and
thunderstorms.  The storm's seemingly endless supply of moisture
and slow movement is a recipe for flooding concerns in these
regions through Friday.  High Risks for excessive rainfall is
forecast for the Southern Appalachians through Thursday morning.  
Widespread flash flooding is expected in and near western North
Carolina.  Landslides and debris flows are possible within steeper
terrain.  By Thursday evening, rainfall amounts could exceed seven
inches in parts of the southern Appalachians.  In addition, high
pressure over the Northeast will produced strong wind over the
parts of the Mid-Atlantic into the Ohio Valley with wind of 15 to
25 mph with gust up to 50 mph on Wednesday.

There is an enhanced risk of severe thunderstorms over parts of
the Northern/Central High Plains.  A cold front should trigger
strong-to-severe storms over the region. Meanwhile, a slow
progressing frontal boundary will be the catalyst for
thunderstorms up and down the High Plains Wednesday and again on
Thursday.  The front's slow progression could also lead to flash
flooding concerns in the Northern and Central High Plains.  To the
south, dry and windy conditions will prevail across the Southwest,
promoting elevated to critical fire weather conditions across much
of the Southwest through the Four Corners region through Wednesday."
