nc_path,target_text
/home/manas/WeatherLMM/forecast_text_Cleaned_6months/forecast_text/2020-04-01/ifs_fc_sfc_0000_12_20200401.nc,"Valid 12Z Wed Apr 01 2020 - 12Z Fri Apr 03 2020

...Heavy snows and cold temperatures will spread from the
Northwest into the Northern Plains over the next couple of days...

...Rain and strong winds will move off the North Carolina coast
later in the morning...

...A large ocean storm will keep rainy and windy weather across
New England into Friday...

A low pressure system will continue to rapidly deepen as it move
quickly off the North Carolina coast this morning, ending the rain
with subsiding winds across the region.  This low pressure system
is forecast to develop into a huge ocean storm while meandering
off the East Coast for the next few days.  Wet snow over northern
Maine is expected to taper off later today as the storm
intensifies further over the Atlantic.  However, with a highly
amplified and blocky synoptic pattern across the higher latitudes,
rainy and windy conditions are expected to move back into New
England from the east on Thursday and continue into Friday as the
massive ocean storm is forecast to retrograde.  High surfs and
some beach erosion are also possible along the coast.

Meanwhile, active weather is expected to progress rather slowly
across the Northwest into the northern Plains for the next two
days under a slow-moving upper level vortex.  Multiple
disturbances within this vortex will interact with an intrusion of
cold air from western Canada.  This complex interaction will
continue to result in heavy snow along the Cascades and portions
of the northern Rockies followed by an increasing chance of snow
expanding northeastward across the northern Plains on Thursday and
into Friday behind a cold front. A swath of mixed precipitation
can also be expected preceding the snow from the northern Plains
into the upper Midwest. Much below normal temperatures are
expected under this weather pattern from the northern Rockies and
gradually spreading across the northern Plains.

Ahead of the cold front, above normal temperatures are expected in
the Southwest to southern/central Plains and parts of the
Mississippi Valley. Meanwhile, the Eastern Seaboard will have cool
afternoons and near normal temperatures in the mornings with
generally northerly winds under the influence of the western
periphery of the huge ocean storm."
/home/manas/WeatherLMM/forecast_text_Cleaned_6months/forecast_text/2020-04-01/ifs_fc_sfc_1200_12_20200401.nc,"Valid 00Z Thu Apr 02 2020 - 00Z Sat Apr 04 2020

...Heavy snow, freezing rain, and cold temperatures will spread
eastward across the north-central U.S. through Friday...

...Rain and scattered thunderstorms expected for the
Southern/Central Plains and Mississippi Valley...

...Wet and windy weather will persist over the Northeast due to a
large low pressure system in the Atlantic...

Over the next couple of days, a strong cold front is expected to
move slowly eastward across the Northern Plains and into the Upper
Midwest, and southeastward across the Central/Southern Rockies and
Central/Southern Plains. Behind this front, temperatures are
forecast to fall much below average across the Northern Rockies to
Northern/Central Plains. These cold conditions will support snow
in these areas. Snowfall amounts of 6 to 12 inches are forecast
for parts of Wyoming and South Dakota into northeastern North
Dakota and northwestern Minnesota. As the cold front passes, rain
could change to sleet or freezing rain before transitioning to
snow. Freezing rain accumulations of over a tenth of an inch are
expected in eastern portions of the Dakotas and western Minnesota.

Along and ahead of the cold front, and ahead of a dryline in the
Southern High Plains, rain and scattered thunderstorms are
expected for portions of the Plains and Mississippi Valley.
Rainfall totals will generally be light, but amounts over an inch
are possible through Friday for central Texas. Behind the dryline,
elevated to critical fire weather conditions are forecast by the
Storm Prediction Center for the Southern High Plains. Warmer than
average temperatures are likely ahead of the cold front.

A deep surface low pressure system is forecast to meander over the
western Atlantic over the next couple of days. Though far
offshore, the enormity of the low will mean the Northeast will
remain under the influence of the low; through Friday, rain and
even some light wet snow in higher elevations are possible for the
Northeast. Windy conditions along with high surf, beach erosion,
and coastal flooding are possible."
/home/manas/WeatherLMM/forecast_text_Cleaned_6months/forecast_text/2020-04-02/ifs_fc_sfc_0000_12_20200402.nc,"Valid 12Z Thu Apr 02 2020 - 12Z Sat Apr 04 2020

...A nor'easter will edge westward closer toward New England,
bringing strong winds, rain, interior wet snow as well as coastal
flooding to the Northeast...

...Heavy snow, freezing rain, and cold temperatures will spread
eastward across the north-central U.S. through Friday...

...Chance of heavy rain increases over central and eastern Texas
Friday into Saturday...

A blocking pattern developing in the higher latitudes will lead to
rather atypical progressions of weather systems across the U.S.
for the next few days.  First of all, a large and intense low
pressure system that has moved off the Mid-Atlantic coast
yesterday is forecast to retrograde, or move back closer toward
the East Coast during the next couple of days.  This will increase
the chance of strong gusty winds along with rain to spread from
east to west across New England today into Friday as a back door
warm front from the Canadian Maritimes sweeps across the region. 
It appears that the storm will edge closer toward New England than
earlier forecasts.  Therefore, coastal sections will be more
likely to be impacted by high winds, flooding, high surf and
possibly beach erosion.  Over the interior sections near the
Canadian border, temperatures are expected to be cold enough to
support wet snow and mixed precipitation.  The storm center is
forecast to make its closest approach to Cape Cod Friday morning
before gradually pulling back out to sea.  Winds and rain are
expected to slowly taper off later on Friday, and may end by
Saturday morning.

Meanwhile on the other side of the country, a strong cold front is
expected to move slowly eastward across the northern Plains and
into the upper Midwest as a broad upper-level vortex interacts
with a surge of cold air from western Canada. Behind this front,
temperatures are forecast to fall much below average across the
northern Rockies to northern and central Plains. A swath of
accumulating snow is expected today from the northern Rockies to
North Dakota. By Friday, the snow should be confined to northern
Minnesota into northern Wisconsin where more than 6 inches of
accumulation is possible. In addition, freezing rain is expected
to precede the snow from the eastern portions of the Dakotas into
western Minnesota.

Along and ahead of the cold front, rain and scattered
thunderstorms are expected for portions of the Plains and down
into the Mississippi Valley. Rainfall totals will generally be
light today, but amounts over an inch are possible on Friday into
early Saturday for central and eastern Texas as moisture from the
Gulf is drawn northward ahead of the strong front.  Behind the
front, elevated to critical fire weather conditions are forecast
by the Storm Prediction Center for the southern High Plains.
Warmer than average temperatures are likely ahead of the cold
front."
/home/manas/WeatherLMM/forecast_text_Cleaned_6months/forecast_text/2020-04-02/ifs_fc_sfc_1200_12_20200402.nc,"Valid 00Z Fri Apr 03 2020 - 00Z Sun Apr 05 2020

...A nor'easter will edge westward closer toward New England,
bringing strong winds, rain, interior wet snow as well as coastal
flooding to the Northeast...

...Heavy snow, freezing rain, and cold temperatures will spread
eastward across the north-central U.S. through Friday...

...Chance of heavy rain increases over central and eastern Texas
Friday into Saturday...

As previously noted, frontal progressions across the U.S. and the
surrounding waters will be atypical over the next few days as a
result of a higher latitude blocking pattern. For the Northeast, a
Nor'easter will retrograde toward the coast sending a warm front
westward through New England. Rain along with a wintry mix in the
higher terrain will spread toward the Great Lakes/Ohio Valley
region. Higher tides, strong winds and coastal flooding is also
expected with this feature.

A strong cold front will slowly progress through the Northern
Plains and widespread snow and wintry precipitation will accompany
it across the north-central U.S. Cold Canadian air will filter
into the region behind the front, bringing temperatures to
well-below average for early April. Numerous Winter Weather
Advisories and Winter Storm Warnings are in effect from Colorado
to Minnesota. Freezing rain is expected from the eastern portions
of the Dakotas into western Minnesota before changing over to all
snow. Many areas across northern Minnesota and northern Wisconsin
could have accumulations of 6 or more inches of snow.

Rain and thunderstorms is expected across the Plains and
Mississippi Valley along and ahead of this strong cold front.
Rainfall amounts and intensities will be the greatest over
portions of central and eastern Texas as this region will have a
nearly continuous feed of Gulf moisture into the frontal boundary.
WPC has highlighted this part of the state as having a Marginal
Risk for Excessive Rainfall through Saturday. The storm Prediction
Center has noted this same general area as having a Slight Risk
for severe weather and there is critical fire weather across most
of New Mexico and extreme western Texas"
/home/manas/WeatherLMM/forecast_text_Cleaned_6months/forecast_text/2020-04-03/ifs_fc_sfc_0000_12_20200403.nc,"Valid 12Z Fri Apr 03 2020 - 12Z Sun Apr 05 2020

...Nor'easter to batter coastal New England with strong winds,
heavy showers, and coastal flooding today...

...Strong early spring cold front to generate travel disruptive
winter weather in the Midwest, severe weather in the Southern
Plains...

...Pacific storm system to usher in both wet and wintry conditions
to the West Coast this weekend...

A powerful nor'easter off the East Coast will continue impact the
New England coast with blustery conditions, heavy showers, high
surf, and coastal flooding through this morning and into the early
evening hours. Scattered showers are also possible across much of
the Northeast but with less punch than what is expected for
coastal New England. Look for showers to taper off Friday night as
the nor'easter heads south and east into the northwest Atlantic
and high pressure builds in from the west. By Saturday, mostly dry
conditions and more a more seasonal temperature regime looks to
settle in across the region.

A strong cold front continues to inch its way across the Midwest
this morning. The front's slow progression combined with the
plummeting temperatures in its wake is causing post-frontal
precipitation to fall in the form of freezing rain from the
Central Plains to the Upper Midwest. Winter Storm Warnings and
Advisories continue through this morning as icy accumulations
ranging between a tenth to two tenths of an inch of ice are
possible, thus making for slick travel conditions in these
regions. Meanwhile, the cold front will march south in the
Southern Plains where it is expected to trigger showers and
thunderstorms this afternoon and evening. Some thunderstorms in
southern and central Texas could be severe with the potential to
produce strong winds and large hail. Thunderstorms will also
contain intense rainfall rates that could lead to localized flash
flooding in the central and eastern portions of the Lone Star
State.

Yet another Pacific storm system will take aim at the West Coast
this weekend. Coastal and valley rain is possible from Oregon to
the Bay Area of California Saturday with heavy snow in the Oregon
Cascades and the Sierra Nevada. The Sierras, in particular, will
likely measure over 1 to 2 feet of snow by the end of the weekend.
Southern California will wait until Sunday for periods of rain to
reach the region with locally heavy amounts possible."
/home/manas/WeatherLMM/forecast_text_Cleaned_6months/forecast_text/2020-04-03/ifs_fc_sfc_1200_12_20200403.nc,"Valid 00Z Sat Apr 04 2020 - 00Z Mon Apr 06 2020

...Severe weather and flash flooding possible in Texas through
tonight...

...Active weather for the West will lead to heavy snow in the
Sierra Nevada through the weekend...

Rain and thunderstorms are expected for Texas through the weekend,
but particularly tonight into Saturday as a cold front slowly
moves across the state. Locally heavy rain causing flash flooding
as well as severe weather, especially potentially large hail in
southern Texas, are possible. There are Slight Risks in place for
both the severe and flash flooding hazards through Saturday
morning.

Farther north, the strong cold front will continue moving eastward
across the Upper Midwest, bringing some light additional snow and
freezing rain totals behind it, but the bulk of the winter weather
has finished in the north-central tier. Colder than normal
temperatures are likely for the central U.S. again on Saturday,
but the cold front should weaken considerably by Sunday as it
loses upper-level support.

A couple of potent upper-level lows approaching the West Coast
will bring precipitation to the Pacific Northwest, California, and
into the Great Basin through the weekend. Rain is expected for
lower elevations with snow for higher elevations. Snowfall amounts
will be largest in the Sierra Nevada and Shastas, with over a foot
or two of snow forecast there. Rain should begin in Southern
California Sunday, and there is a possibility of localized
flooding there particularly over burn scars. Colder than average
temperatures are also expected in the West.

The large Atlantic low pressure system is forecast to move
eastward tonight into Saturday. This evening and tonight, showers
could continue over the Northeast, along with windy conditions and
the potential for coastal flooding in the Mid-Atlantic region.
These conditions should end early Saturday as the low moves
farther offshore."
/home/manas/WeatherLMM/forecast_text_Cleaned_6months/forecast_text/2020-04-04/ifs_fc_sfc_0000_12_20200404.nc,"Valid 12Z Sat Apr 04 2020 - 12Z Mon Apr 06 2020

...Heavy showers and thunderstorms to persist across central and
southern Texas today...

...California braces for Pacific storm system to produce copious
amounts of rain and mountain snow this weekend...

...Nor'easter departs this morning, cool temperatures across the
Plains on Saturday will rebound to more spring-like levels by
Sunday...

A potent cold front sweeping across south Texas and into northern
Mexico early this morning will help to diminish the severe threat
on Saturday. However, persistent southwesterly flow aloft with
embedded upper level disturbances will aid in additional showers
and thunderstorms throughout the from central and southern Texas
to Arkansas and Louisiana. Rainfall rates could be high within
heavier showers and thunderstorms and may promote the threat for
localized flash flooding in parts of south Texas. Shower and
thunderstorm activity is expected to taper off Saturday night with
only a few stray showers and thunderstorms possible across Texas
on Sunday and into Sunday night.

The next weather headliner will be a deep and anomalous upper
trough that will slam into California this weekend. Through
Monday, rainfall totals in the valleys and coastal areas of Oregon
and California will ranger between 1 to as much as 3 inches. In
the higher elevations snow will start to fall in the Sierra Nevada
on Saturday, then fall and accumulate at a rapid pace on Sunday.
Heavy snow will continue into Monday and begin to gradually taper
off Monday night. By Tuesday morning, portions of the Sierra
Nevada are forecast to receive anywhere from 1 to as much as 4
feet of snow with locally higher amounts possible in the highest
elevations. In addition to the heavy precipitation totals,
temperatures are likely to remain below normal throughout the
weekend and into the start of the upcoming week.

The nor'easter that has generated heavy showers, strong wind
gusts, and coastal flooding is heading east deeper into the
northwest Atlantic this morning. This should make for drier
conditions along much of the East Coast Saturday with seasonally
mild temperatures on tap. Further west, the Plains will start out
the weekend on a cool note but moderating temperatures are likely
to take shape on Sunday. By Monday, temperatures from the front
range of the Rockies to the East Coast are forecast to feel more
like May than early April. Temperatures will only continue to warm
across the Heartland and into most eastern regions on Tuesday."
/home/manas/WeatherLMM/forecast_text_Cleaned_6months/forecast_text/2020-04-04/ifs_fc_sfc_1200_12_20200404.nc,"Valid 00Z Sun Apr 05 2020 - 00Z Tue Apr 07 2020

...Precipitation is likely for the West, with heavy snow in the
Sierra Nevada and the potential for flash flooding in Southern
California...

...Increasing warmth from the Rockies eastward and colder than
normal in the West...

For the beginning of next week, a potent upper-level low is
forecast to dive southeastward through the Eastern Pacific and
move into California. This will provide support for precipitation
as it pulls in Pacific moisture. Lower elevation rain and higher
elevation snow is likely for much of the West. The highest
snowfall totals are forecast for the Sierra Nevada--where multiple
feet of snow are likely and Winter Storm Warnings are in effect.
Meanwhile, the Shastas and the Wind River Mountains/Tetons could
see several inches of snow. As rain takes aim at Southern
California beginning Sunday, rainfall amounts could cause
flooding/flash flooding problems early next week. This is
particularly a concern over burn scars.

Farther east, rain showers and a few thunderstorms are expected
once again across Texas. These could produce locally heavy rain
through this evening, which could cause isolated flooding concerns
particularly over southern Texas, especially over areas that have
received quite a bit of rain over the last couple days. Showers
are also possible along a weakening cold front moving across the
Ohio Valley tonight and the Northeast and Mid-Atlantic Sunday.
Rainfall totals will be very light with these showers.

Temperature-wise, the upper-level low approaching California will
produce much below normal temperatures over California and Nevada.
High temperatures are also forecast to be a few degrees below
average in the Northwest. Meanwhile, temperatures should moderate
and warm quite a bit over much of the Plains through Monday as
upper-level ridging builds. Highs in the 70s are forecast as far
north as South Dakota by Monday. The East can expect high
temperatures that are about 10 degrees warmer than average."
/home/manas/WeatherLMM/forecast_text_Cleaned_6months/forecast_text/2020-04-05/ifs_fc_sfc_0000_12_20200405.nc,"Valid 12Z Sun Apr 05 2020 - 12Z Tue Apr 07 2020

...California braces for significant mountain snowfall, heavy
rain, potential flash flooding, and gusty winds as a strong
Pacific storm system slams into the state today and Monday...

...Warming trend to engulf much of the eastern two thirds of the
U.S. the first half of the week...

...Showers and thunderstorms forecast to flare up in the
Mississippi and Ohio Valleys late Monday and into Tuesday...

California is feeling the initial affects of an intensifying storm
system off the West Coast this morning with heavy showers tracking
through portions of central California. This is only the start of
what will be a busy Sunday as copious amounts of Pacific moisture
stream out ahead of the storm this morning. In the Sierras, snow
will accumulate in a hurry as snow falls fast and furious up and
down the mountain range today and into Monday. Snow will be
measured in feet while the combination of heavy snow and gusty
winds lead to treacherous travel and whiteout conditions.
Meanwhile, rain will all heavily at times, especially for those
along the coastal range and the Southern California mountain
ranges. Rainfall totals are forecast to exceed 3 inches in the
higher elevations with locally higher amounts possible. Even lower
elevation areas will see plenty of rain with urbanized flooding
possible. Moderate and Slight risks for excessive rainfall are in
place for portions of Southern California today and a Slight risk
remains in place for far Southern California on Monday. Look for
conditions to improve state-wide by Tuesday morning, although
abnormally cool temperatures will remain in the forecast on
Tuesday.

While temperatures stay cool along the West Coast, folks from the
front range of the Rockies to the East Coast will warm up through
the first half of the week. Temperature anomalies in the Midwest
will jump to 10 to 15 degrees above normal by Tuesday with daytime
highs soaring into the 80s. To the south, temperatures in the
upper 60s and low 70s in the Deep South could tie or break daily
record warm low temperatures Tuesday morning and continuing into
the latter half of the week. The East Coast will also enjoy more
spring-like temperatures with the lone exception being New England
as a cold front drops their temperatures seasonally cooler levels
by mid-week. Spring lovers in the central and eastern regions will
want to enjoy this stretch of warmer weather while they can as
cooler temperatures are forecast to return the second half of the
week.

The return of warmer temperatures in the Midwest and across the
Gulf Coast will also mean a chance for spotty showers and
thunderstorms late in the day on Monday. As a warm front in the
the Mississippi Valley lifts east towards the Ohio Valley and
Mid-Atlantic on Tuesday, areas of showers and thunderstorms will
follow suit leading to wetter conditions from the Mid-Atlantic on
south into the Southeast. The Ohio Valley in particular could be
contend with severe thunderstorms and the potential for localized
flash flooding on Tuesday."
/home/manas/WeatherLMM/forecast_text_Cleaned_6months/forecast_text/2020-04-05/ifs_fc_sfc_1200_12_20200405.nc,"Valid 00Z Mon Apr 06 2020 - 00Z Wed Apr 08 2020

...Significant mountain snows, heavy rain, potential flash
flooding, and gusty winds continue in California...

...Showers and thunderstorms forecast for the central and eastern
U.S., with severe weather possible for the Ohio Valley Tuesday...

...Warming weather will engulf much of the eastern two-thirds of
the U.S. for the first half of the week...

An anomalously deep upper-level low is forecast to continue moving
southward just offshore of California for the beginning of the
week, causing persistent precipitation as copious amounts of
moisture stream in. Heavy rain is possible in lower elevations of
coastal California and into the valleys. This could cause flooding
and flash flooding in some areas, particularly over burn scars,
and runoff is possible in urbanized areas as well. There is a
Moderate Risk of excessive rainfall in place today to outline this
concern; the chance may lessen some by Monday, but there remains a
Slight Risk of excessive rainfall outlooked then. Meanwhile in
higher elevations of the Sierra Nevada, snow will continue to
accumulate rapidly, and total amounts should be measured in
multiple feet of snow through Monday. The Great
Basin/Intermountain West can also expect precipitation with
frontal systems in the vicinity, and the Wind River
Mountains/Tetons are forecast to see several inches of snow
through Monday. Furthermore, windy conditions and colder than
normal temperatures are expected for California into parts of the
Southwest.

Farther east, areas from the Southern Plains to Mississippi Valley
to the Eastern Seaboard could see scattered showers and
thunderstorms over the next couple days. Rainfall chances should
ramp up for the Ohio Valley Monday and especially into Tuesday
with a warm front in the vicinity, and rainfall of an inch is
possible in some areas, which could cause localized flooding
problems. Severe weather will also be a concern--the Storm
Prediction Center has outlooked a Slight Risk of severe weather
for a good portion of the Ohio Valley on Tuesday.

While the West will be experiencing cooler than average
temperatures, temperatures from the Rockies eastward are forecast
to warm quite a bit for the early part of the week. The most
anomalous warmth can be expected for the Central Plains and
portions of the Midwest Monday and Tuesday, with high temperatures
nearing 70 as far north as South Dakota and Minnesota, 15 to 20
degrees above average. High temperatures around 10 degrees above
normal will be widespread from the Gulf Coast to the Great Lakes
and east to the Eastern Seaboard."
