nc_path,target_text
/home/manas/WeatherLMM/forecast_text_Cleaned_6months/forecast_text/2020-02-17/ifs_fc_sfc_0000_12_20200217.nc,"Valid 12Z Mon Feb 17 2020 - 12Z Wed Feb 19 2020

...Heavy snow across parts of the Upper Great Lakes...

...Snow over the Cascades and Northern/Central Rockies will wind
down...

...Areas where river flooding is occurring will receive additional
light rain...

An area of developing low pressure over Central Plains will move
northeastward to the Upper Great Lakes by Tuesday morning then
continue moving northeasterly into Southeastern Canada on Tuesday
evening into Wednesday.  The storm will produce light snow over
parts of the Upper Mississippi Valley and light rain over parts of
the Lower Mississippi Valley on Monday morning.  By Monday evening
the snow will move into the Upper Great Lakes, that may be heavy
at times, then by Tuesday morning the snow will be over parts of
the Lower Great Lakes and the Northeast that will wane by
Wednesday morning.  There could be a few areas of mixed
precipitation over parts of the Northeast overnight Tuesday. 
Along the associated front, rain will fill in from parts of the
Western Ohio Valley/Middle Mississippi Valley southward to the
Lower Mississippi Valley/Central Gulf Coast by Monday evening. 
The rain will move into parts of the Great Lakes/Ohio Valley
southward to the Southeast moving to the East Coast by Tuesday
evening.  Rain will continue over the Western/Central Gulf Coast
into the Southeast through Wednesday.  The light rain will fall on
areas where river flooding is occurring. 

Meanwhile, rain and higher elevation snow over the Pacific
Northwest eastward over the Northern/Central Rockies will slowly
come to an end mainly By Tuesday as the onshore flow ends and the
upper-level energy moves eastward.    

Temperatures will be milder than normal for the southern and
southeastern U.S. before colder air arrives behind a strong cold
front on Tuesday.  Milder air will also move up the Mid-Atlantic
on Tuesday as the rain arrives."
/home/manas/WeatherLMM/forecast_text_Cleaned_6months/forecast_text/2020-02-17/ifs_fc_sfc_1200_12_20200217.nc,"Valid 00Z Tue Feb 18 2020 - 00Z Thu Feb 20 2020

...Snow across parts of the Upper Great Lakes tonight expected to
spread into New England on Tuesday...

...Cold conditions expected across much of the country by
Wednesday morning...

...Areas where river flooding is occurring will receive additional
rain...

A low pressure system with multiple fronts is currently organizing
over the central Plains.  This system is spreading cold rain
across the Midwest toward the lower Great Lakes as snow begins to
develop over Minnesota.  The low is forecast become more
consolidated as it moves across the Great Lakes tonight.  This
will lead to snow to expand across the upper Midwest and into the
upper Great Lakes tonight into Tuesday morning.  Meanwhile, the
system will continue to ingest moisture from the Gulf of Mexico
and bring an increasing chance of rain expanding across the Deep
South into the southeastern U.S. through Tuesday.  Father north,
snow is expected to overspread northern New England on Tuesday as
mixed precipitation moves into central new England.  By Tuesday
night, much of the Mid-Atlantic should see rain as a cold front
passes through the region.

A large dome of cold air from Canada will gradually overspread
much of the Great Plains into the Great Lakes behind the low
pressure system on Tuesday.  The cold air will then continue
eastward through much of the eastern U.S. on Wednesday.  Below
normal temperatures will be common across the eastern two-thirds
of the country by Wednesday morning.  The coldest locations will
be over the northern Plains where temperatures are forecast to be
more than 20 degrees below normal.  Meanwhile, scattered snow
showers are continuing across the northern and central Rockies as
well as the nearby High Plains.  As a high pressure system
associated with the cold air mass pushes southward, the chance of
snow is expected to increase over Colorado on Wednesday due to the
increase of upslope flow from the northeast across the region.

Meanwhile, rain and scattered thunderstorms will be slow to move
out of the Gulf Coast into the Southeast U.S. coast behind a cold
front.  More rain is expected for Texas on Wednesday as the next
upper-level system arrives.  Florida will remain very warm through
Wednesday with high temperatures reaching the low to mid 80s."
/home/manas/WeatherLMM/forecast_text_Cleaned_6months/forecast_text/2020-02-18/ifs_fc_sfc_0000_12_20200218.nc,"Valid 12Z Tue Feb 18 2020 - 12Z Thu Feb 20 2020

...Additional heavy rains likely across flood ravaged areas of the
South...

..Accumulating snows possible Tuesday from northern New York State
into northern New England...

...A broad region of arctic high pressure will settle south into
the Northern to Central Plains Tuesday, Wednesday and Thursday...


A surface frontal boundary pushing southeast from the Lower
Mississippi Valley/Tennessee Valley region into the Southeast
Tuesday into Wednesday will be accompanied by bands of heavy rains
along and ahead of the front.  These rains will be falling across
areas of the South that are experiencing historic flooding,
exacerbating these flooding conditions.  Drier weather likely
Wednesday across the hardest hit flooding regions of Mississippi,
but additional rains may push back into this region late Wednesday
night into Thursday.

An area of low pressure is forecast to push east northeastward
from the upper Great Lakes into southeast Canada on Tuesday.  This
low will support an area of accumulating snows from northern New
York State into northern New England.  The quick movement of the
storm should keep snowfall totals from being very heavy, with
mostly moderate to locally heavy totals expected.

In the wake of the low moving northeastward from the upper Lakes
region, a broad region of arctic high pressure will be sinking
southward into the Northern to Central Plains region Tuesday,
Wednesday and Thursday.  This cold airmass will spread below
average temperatures across much of the Plains Tuesday and
Wednesday, spreading eastward through the Mississippi Valley and
the remainder of the east by Thursday."
/home/manas/WeatherLMM/forecast_text_Cleaned_6months/forecast_text/2020-02-18/ifs_fc_sfc_1200_12_20200218.nc,"Valid 00Z Wed Feb 19 2020 - 00Z Fri Feb 21 2020

...Heavy rainfall and areas of flash flooding are expected across
portions of the South through Wednesday...

...A strong and broad area of Arctic high pressure will settle
south across the Northern to Central Plains and Midwest going
through midweek...

...Some accumulating snow possible for eastern North Carolina late
Thursday...

A very strong cold front pushing southeast across the Lower
Mississippi/Tennessee Valley region and into the Southeast will be
accompanied by bands of heavy rain and thunderstorms going through
tonight and early Wednesday. These rains will be falling across
areas of the South that are experiencing historic flooding,
especially over central Mississippi, and the additional rainfall
will prolong ongoing runoff problems and foster additional areas
of flash flooding. Unfortunately, significant river flooding is
likely to continue for several more days.

Drier and much colder weather is expected to filter south in
behind this cold front, and a very strong area of Arctic high
pressure will drop south from Canada and facilitate a large area
of below normal temperatures including portions of the
Intermountain West, the Plains, Midwest and Eastern U.S. by late
Wednesday. This cold air will filter all the way down across the
Gulf Coast states by Thursday, and regionally the temperatures are
forecast to be as much as 15 to 25 degrees below normal.

Aside from the rainfall threat with the front in the near-term,
there will also be a wave of low pressure developing along the
same front as it moves offshore of North Carolina by late
Thursday. This coupled with the cold air is expected to favor a
threat of accumulating snow for the coastal plain of North
Carolina going through Thursday night, and a few inches of snow
will be possible here.

The remainder of the country will be very dry, with temperatures
that will be near normal, which will include the Pacific Northwest
and the Southwest U.S. going through the end of the week. Only
southern Florida will tend to have temperatures warmer than normal
this week, but that should change by Friday as the aforementioned
cold front finally crosses down the full length of the Florida
Peninsula."
/home/manas/WeatherLMM/forecast_text_Cleaned_6months/forecast_text/2020-02-19/ifs_fc_sfc_0000_12_20200219.nc,"Valid 12Z Wed Feb 19 2020 - 12Z Fri Feb 21 2020

...Additional rains likely across flooded regions of the South
during Wednesday and Thursday...

...A broad region of Arctic high pressure will encompass much of
the central and eastern U.S. over the next few days...

...An accumulating snow threat from the lee of the Central Rockies
into the Central Plains Wednesday into Thursday and across much of
North Carolina, northern South Carolina and southern Virginia late
Thursday into early Friday...


Soils remain saturated across portions of the South from recent
heavy rains with ongoing major to historic river flooding.  While
precipitation coverage and intensities are expected to decrease
Wednesday morning across the South, another round of precipitation
is expected to push eastward from the Southern Plains Wednesday
night and move across the South and Southeast on Thursday. 
Additional moderate to heavy rains possible across these areas,
exacerbating the ongoing major to historic river flooding across
portions of the South.

A broad region of Arctic high pressure pushing into the north
central region of the nation Wednesday morning will continue to
spread east southeastward Wednesday and encompass much of the
central to eastern U.S.  This high will keep temperatures below
average mid week across much of central to eastern U.S. except for
central to south Florida where above average temperatures will
persist.    However, this cold spell will be brief with
temperatures beginning to rebound to above average levels by
Friday across the Northern Plains into the Upper Mississippi
Valley.  This warming trend is then expected to push eastward by
the weekend across the Great Lakes and into the Northeast.

The broad region of cold air will support accumulating snows
Wednesday into early Thursday from the lee of the Central Rockies
into the Central Plains.  Accumulating snow potential is also
possible late Thursday into early Friday from the Southern
Appalachians, eastward across much of North Carolina, northern
South Carolina and southern Virginia.

Dry weather will persist across much of western U.S. from the west
coast into the Great Basin and Northern Rockies.  Temperatures are
expected to be above average from the Southwest, southern Great
Basin and along all of the west coast."
/home/manas/WeatherLMM/forecast_text_Cleaned_6months/forecast_text/2020-02-19/ifs_fc_sfc_1200_12_20200219.nc,"Valid 00Z Thu Feb 20 2020 - 00Z Sat Feb 22 2020

...Additional rains likely across flooded regions of the South
through Thursday...

...A broad region of Arctic high pressure will encompass much of
the central and eastern U.S. over the next couple of days...

...Accumulating snowfall is expected for the lee of the central
Rockies and the central High Plains through Thursday, and across
much of North Carolina, northern South Carolina and southern
Virginia late Thursday into early Friday...

Soils remain saturated across portions of the South from recent
heavy rains with ongoing major to historic river flooding. While
precipitation coverage and intensities are expected to decrease
today across the South, another round of precipitation is expected
to push eastward from the southern Plains tonight and move east
across the Gulf Coast states and Southeast on Thursday. Additional
moderate to heavy rainfall is expected across these areas,
exacerbating the ongoing significant river flooding across areas
of the South.

Meanwhile, a broad region of Arctic high pressure pushing down
across the north-central U.S. today will spread east-southeastward
and encompass much of the central to eastern U.S. going through
Thursday. This high will keep temperatures below average for this
part of the country, with exception to central and south Florida
where above average temperatures will persist through the balance
of the week. Overall, the cold spell will be brief with
temperatures beginning to rebound to above average levels by
Friday across the northern Plains and Upper Midwest. This warming
trend will then translate eastward this weekend across the Great
Lakes and Northeast.

In the short-term, the cold air filtering south will support
accumulating snowfall through early Thursday from the lee of the
central Rockies and over the central High Plains. Accumulating
snow is also now likely late Thursday through early Friday from
the southern Appalachians, eastward across much of North Carolina,
northern South Carolina and southern Virginia where locally
several inches of snow is expected.

Elsewhere, dry weather will persist across much of western U.S.
from the West Coast into the Great Basin and the northern Rockies.
Temperatures are expected to be somewhat warmer than normal along
the West Coast and into the Great Basin through Friday. However,
there will be a weak area of low pressure coming into the
Southwest by this weekend which will bring some clouds and showers
along with temperatures trending below normal."
/home/manas/WeatherLMM/forecast_text_Cleaned_6months/forecast_text/2020-02-20/ifs_fc_sfc_0000_12_20200220.nc,"Valid 12Z Thu Feb 20 2020 - 12Z Sat Feb 22 2020

...Snow for the Carolinas and lake effect snow down wind from the
Great Lakes...

...Additional rain likely across flooded regions of the South
through Thursday....

...Temperatures will be 10 to 25 degrees below average over the
Upper/Middle Mississippi Valley, Southern Plains, and parts of the
Northern/Central Rockies into the Southeast...

Up to 1.5 inches of additional rain will fall over parts of the
Lower Mississippi Valley to the Southeast mainly on Thursday. 
Overrunning moisture and upper-level energy will aid in producing
rain over areas hit by Heavy rain during the last 14 days.  The
WPC has issued a marginal risk of excessive rainfall over this
area.  Flash flood watches are up over this area. The marginal
risk means isolated flash flooding is possible. 

Meanwhile, a cold dome of Arctic high pressure pushing down across
the Rockies and Plains will spread east-southeastward over the
Lower Mississippi Valley to the Ohio Valley and the Southeast.
This high will keep temperatures 10 to 25 degrees below average
for this part of the country.  The cold air will support
accumulating snow on Thursday evening into Friday evening over the
Southern Appalachians, eastward across much of North Carolina,
Northern South Carolina and Southern Virginia where locally
several inches of snow are expected. In addition, with the cold
air flowing over the Great Lakes, lake effect snow will develop on
Friday. The heaviest snow will be down wind from Lakes Ontario and
Erie.

Elsewhere, dry weather will persist across much of Western U.S.
from the West Coast into the Great Basin and the Northern Rockies.
However, there will be a weak area of low pressure coming into the
Southwest by Saturday which will bring some clouds and showers
along with temperatures trending below normal."
/home/manas/WeatherLMM/forecast_text_Cleaned_6months/forecast_text/2020-02-20/ifs_fc_sfc_1200_12_20200220.nc,"Valid 00Z Fri Feb 21 2020 - 00Z Sun Feb 23 2020

...Periods of rain and potential flash flooding over the Southeast
this afternoon...

...Snow in portions of the Carolinas and Southern Appalachians,
chilly temperatures to follow ...

...Exceptionally dry Friday, wet and wintry weather arrives in the
Southwest this weekend...

An area of low pressure tracking along a frontal boundary draped
over the coastal southeastern U.S. is responsible for a pair of
weather hazards over the Southeast this afternoon and evening.
First, rain continues to fall throughout much of the Southeast
this afternoon. Soil moisture remains overly saturated and rivers
and streams are high in portions of the Southeast, thus making
flash flooding a concern through Thursday evening. As a result,
Flash Flood Watches have been issued for portions of central
Alabama and central Georgia where the heaviest rainfall rates are
expected to occur through this evening.

Second, sub-freezing temperatures are spilling in from the north
causing precipitation to fall as snow in portions of the Tennessee
Valley and the Southern Appalachians this afternoon. As the storm
intensifies off the Carolina coast this evening, rain will
changeover to snow in southeast Virginia, central and eastern
North Carolina, and the Appalachians of South Carolina and
northern Georgia. The heaviest snowfall will be located over
east-central North Carolina and southeast Virginia where 3 to 6
inches of snow is expected. Locally higher totals in excess of 6
inches are possible. Drier conditions will return once the storm
tracks into the heart of the northwest Atlantic Friday morning,
but well below normal temperatures will engulf much of the south
on Friday and persist into Saturday as a dome of Arctic high
pressure takes control.

Speaking of high pressure, the affects from this massive dome of
high pressure will be felt from coast to coast Friday morning with
very little precipitation in the forecast much of the day.
Precipitation will be on the increase over the Southwest Friday
night as an upper-level trough approaches from the west. By
Saturday the upper level trough, tapping into subtropical moisture
from the East Pacific, will advance through the Southwest region
with widespread showers and even a few thunderstorms possible in
the desert regions. Precipitation is welcomed in parched areas of
the Four Corners region but some localized totals in excess of an
inch could lead to flash flooding concerns in south-central
Arizona. Meanwhile, mountain snow is likely to develop from the
Sierra Nevada and the Great Basin to the Wasatch on Saturday. Snow
will then reach the Colorado Rockies by Saturday night and
continue into the day on Sunday."
/home/manas/WeatherLMM/forecast_text_Cleaned_6months/forecast_text/2020-02-21/ifs_fc_sfc_0000_12_20200221.nc,"Valid 12Z Fri Feb 21 2020 - 12Z Sun Feb 23 2020

...Snow and sleet ending this morning across portions of the
Carolinas...

...Cold weather across the eastern two-thirds of the country will
gradually moderate...

...A storm system is expected to spread mountain snows and areas
of heavy rain across the Southwest this weekend...

The weather across much of the U.S. will quiet down for the time
being today as a large dome of cold high pressure system
dominates.  Portions of the Carolinas will wake up with a couple
inches of snow this morning as an area of low pressure moves
rapidly out into the Atlantic.  Some sleet and/or mixed
precipitation can also be expected farther south before ending
early in the morning.

A large dome of high pressure system behind the departing storm
will bring a brief period of quiet weather for much of the country
this afternoon.  This high pressure system will keep chilly
conditions for much of the South and into the Mid-Atlantic through
the weekend.  Meanwhile, milder air will return across the
Southwest as well as the northern Plains.

By the weekend, unsettled weather will quickly move into the
Desert Southwest as a low pressure system currently developing
over the eastern Pacific moves onshore.  It appears that this
system will deliver a decent amount of wet snow for the higher
elevations of the Southwest through the central Rockies this
weekend.  For the lower elevations,  widespread rain and even some
thunderstorms can be expected.  Although precipitation is welcomed
in the parched areas of the Four Corners region, localized
rainfall totals in excess of an inch could lead to flash flooding
concerns in south-central Arizona.  Meanwhile, mountain snow is
likely to develop from the Sierra Nevada and the Great Basin to
the Wasatch on Saturday. Snow will then reach the Colorado Rockies
by Saturday night and continue into the day on Sunday.  Rain will
also develop quickly over the central Plains Sunday morning as the
low pressure system consolidates over the central High Plains."
/home/manas/WeatherLMM/forecast_text_Cleaned_6months/forecast_text/2020-02-21/ifs_fc_sfc_1200_12_20200221.nc,"Valid 00Z Sat Feb 22 2020 - 00Z Mon Feb 24 2020

...Cold temperatures across the eastern two-thirds of the country
will gradually moderate this weekend...

...A Pacific storm system to impact the Southwest on Saturday,
Central Rockies/Plains on Sunday...

...Rain and mountain snow return to the Northwest on Sunday ...

The Lower 48 will continue to observe tranquil weather conditions
through this evening as a large dome of high pressure remains in
control. Chilly temperatures will be felt across the eastern half
of the country tonight and Saturday morning with the coldest
anomalies located in the Southeast. A few Freeze Warnings have
been issued for parts of the Lower Mississippi Valley and the
Southeast early Saturday morning. As high pressure slides eastward
throughout the weekend, winds will shift out of the south and
southwest over the Nation's Heartland, Great Lakes, and Northeast
leading to the return of milder temperatures.

The first in a pair of Pacific storm systems to impact the U.S.
arrives late tonight in the Southwest as a low pressure system
approaches the region. This storm system will tap into a source of
deep moisture originating from the subtropical Pacific and send
said moisture into the Southwest on Saturday. In response, rain
will develop across the Southwest with thunderstorms also possible
in portions of southern Arizona and New Mexico. The heaviest
rainfall looks to be concentrated in the higher elevations of
western New Mexico and south-central Arizona where rainfall totals
ranging between 1 and 2 inches is possible. A Slight Risk for
Excessive Rainfall has been issued for these areas due to heavy
rainfall rates potentially causing areas of flash flooding on
Saturday. By Sunday, this storm system will intensify in the
Central Plains generating areas of showers and a few
thunderstorms. Look for mountain snow to fall from the southern
Sierra Nevada and the Wasatch to the Colorado Rockies this weekend
as well.

Further north, a separate Pacific storm system will cause an
increase in showers and and mountain snow over the Pacific
Northwest on Sunday. The Olympics and Cascades will receive more
mountain snow while the valleys and coastal areas see rain. The
storm system will then track into the northern Rockies Sunday
night leading to more areas of mountain snow through Monday
morning."
/home/manas/WeatherLMM/forecast_text_Cleaned_6months/forecast_text/2020-02-22/ifs_fc_sfc_0000_12_20200222.nc,"Valid 12Z Sat Feb 22 2020 - 12Z Mon Feb 24 2020

...An energetic storm system expected to impact the Southwest on
Saturday, Central Rockies/Plains on Sunday, and into the
Mid-Mississippi Valley by Monday...

...Rain and mountain snow return to the Northwest on Sunday
reaching the northern High Plains by Monday...

After a day of tranquil conditions across much of the country on
Friday, unsettled weather is expected to move quickly into the
southwestern U.S. followed by the Pacific Northwest this weekend. 
A large high pressure system responsible for the tranquil weather
will gradually weaken and then slide off the East Coast during the
next few days.  Chilly conditions across the eastern half of the
country will gradually moderate to above normal levels by Monday
as winds shift to a more southerly direction.  Meanwhile, a low
pressure system that has been developing over the eastern Pacific
is taking aim at the southwestern U.S. This storm system will tap
into moisture originating deep from the tropical Pacific and begin
to spread rain into the Desert Southwest today with the
possibility of thunderstorms this afternoon and evening across
portions of Arizona and New Mexico. The heaviest rainfall looks to
be concentrated in the higher elevations of western New Mexico and
south-central Arizona where rainfall totals ranging between 1 and
2 inches is possible. A Slight Risk for Excessive Rainfall has
been issued for these areas due to heavy rainfall rates
potentially causing areas of flash flooding today.  In addition,
mountain snow is expected from the southern Sierra Nevada and the
Wasatch to the Colorado Rockies through this weekend.

By Sunday, this storm system is forecast to intensify as it moves
into the central High Plains.  Showers and some thunderstorms are
expected to quickly develop and expand across the central Plains
toward the Mid-Mississippi Valley through Sunday night. Some
wintry precipitation is also possible farther to the north from
across the central Plains into the upper Midwest and the lower
Great Lakes Sunday night into Monday morning.  The southern
Appalachians could also see wintry precipitation developing Monday
morning as thunderstorms will likely be moving across the lower to
mid-Mississippi Valley ahead of the intensifying storm.

Farther north, another low pressure system will cause an increase
in showers and and mountain snow over the Pacific Northwest on
Sunday. The Olympics and Cascades will receive more mountain snow
while the valleys and coastal areas see rain. The storm system
will then track into the northern Rockies Sunday night leading to
more areas of mountain snow.  The snow will then expand farther
east into the northern Plains as the storm center moves into the
northern High Plains by Monday morning."
